ID;Spalte1;Haupteintrag;Nr;Funktion;Inhalt;Zusatz;Typ2
i00211;Äbte der Kirchenprovinz Reims;Äbte der Kirchenprovinz;1017;Empfänger;Äbte der Kirchenprovinz;;t:persName
i01598;Äbte und Kirchenprälaten der Kirchenprovinz Reims;Äbte und Kirchenprälaten der Kirchenprovinz Reims;950;Empfänger;Bischöfe, Äbte und Kirchenprälaten der Kirchenprovinz Reims;Reims;t:orgName
i01124;Alle Gläubigen;alle Gläubigen;15;Empfänger;alle Gläubigen;;t:persName
i01269;Archidiakone, Dekane und Priester in Reims, Trier, Metz, Verdun und Lüttich;Archidiakone, Dekane und Priester;1060;Empfänger;Archidiakone, Dekane und Priester;;t:persName
i02003;Arras, Domkapitel;Domdekan und Domkapitel von Arras;1115a;Empfänger;Domdekan und Domkapitel von Arras;Arras;t:persName
i04134;Avallon, Stiftskirche Saint-Lazare;Kanoniker der Stiftskirche Saint-Lazare in Avallon Yonne, Diözese Autun;1087;Empfänger;Kanoniker der Stiftskirche Saint-Lazare in Avallon (Yonne, Diözese Autun);Saint-Lazare in Avallon (Yonne, Diözese Autun);t:persName
i04327;Bath, bischöfliche Kirche;Kirche von Bath Somerset;1048;Empfänger;Kirche von Bath (Somerset);Bath (Somerset);t:orgName
;;;147;;, Herzog von Burgund);Burgund;t:persName
i02214;Bischöfe der Kirchenprovinz Reims;Erzbistum Reims;170;;Erzbistum Reims;Reims;t:orgName
i07117;Bischöfe der Kirchenprovinz Sens;und Sens;181;;und Sens;Sens;t:orgName
i07125;Bischöfe der Kirchenprovinz Tours;und Tours;361;Empfänger;und Tours;Tours;t:persName
i07607;Bischöfe der Kirchenprovinz Trier;Bischöfe der Kirchenprovinz Trier;1155;;;;t:orgName
i01602;Bischöfe der Kirchenprovinzen Bourges, Reims, Tours und Rouen;Bischöfe der Kirchenprovinz;73;Empfänger;Bischöfe der Kirchenprovinz;;t:orgName
i07608;Bischöfe der Kirchenprovinzen Reims und Rouen;Bischöfe der Kirchenprovinzen Reims und Rouen;;;;;t:orgName
;;;1121;Empfänger;, Kardinalpriester von Santa Sabina;Santa Sabina;t:persName
i06588;Bischöfe der Kirchenprovinzen Reims und Sens;Suffragane;69;;Suffraganen;;t:persName
;;;613;;), Kardinalpriester von Santi Nereo ed. Achilleo;Santi Nereo ed. Achilleo;t:persName
i06662;Bischöfe der Kirchenprovinzen Reims, Sens und Tours;Suffragane seiner Kirchenprovinz;137;;Suffragane seiner Kirchenprovinz;;t:persName
i01607;Bischöfe Galliens;Bischöfen Galliens;72;;Bischöfen Galliens;Galliens;t:orgName
;;;511;Empfänger;, Legaten des apostolischen Stuhles;;t:persName
i01606;Bischöfe Germaniens;Bischöfe Germaniens;201;Aussteller;Bischöfen der Germani;Germani;t:orgName
i01610;Bischöfe und Kardinäle der heiligen römischen Kirche;Bischöfe und Kardinäle der heiligen römischen Kirche;671;Empfänger;Bischöfe und Kardinäle der heiligen römischen Kirche;;t:persName
i01876;Castelletto, Cluniazenserpriorat San Pietro;Cluniazenserpriorats San Pietro in Castelletto Monastero prov. Vercelli, Diözese Vercelli;1088;Empfänger;(Cluniazenser)priorats San Pietro in Castelletto (Monastero) (prov. Vercelli, Diözese Vercelli);San Pietro in Castelletto (Monastero) (prov. Vercelli, Diözese Vercelli);t:orgName
i07574;Cercamp, Zisterzienserabtei Notre-Dame;"Zisterzienserabtei Cercamp Frévent, c. Auxi-le-Château, arr. Arras, Nord; Diözese Amiens";1008;;"Zisterzienserabtei Cercamp (Frévent, c. Auxi-le-Château, arr. Arras, Nord; Diözese Amiens)";"Cercamp (Frévent, c. Auxi-le-Château, arr. Arras, Nord; Diözese Amiens)";t:orgName
i04149;Châlons-en-Champagne, Stiftskirche Notre-Dame-en-Vaux;Kanoniker von Notre-Dame-en-Vaux in Châlons-en-Champagne;1104a;Empfänger;Kanoniker von Notre-Dame-en-Vaux (in Châlons-en-Champagne);Notre-Dame-en-Vaux (in Châlons-en-Champagne);t:persName
i01469;Clermont-Ferrand, Benediktinerabtei Saint-Allyre;Benediktinerabtei Saint-Allyre in Clermont-Ferrand, Puy-de-Dôme;1106;Empfänger;Benediktinerabtei Saint-Allyre in Clermont(-Ferrand, Puy-de-Dôme);Saint-Allyre in Clermont(-Ferrand, Puy-de-Dôme);t:orgName
i00217;Corbie, Abtei Saint-Pierre;Abtei Corbie;228;;Abtei Corbie;Corbie;t:orgName
i06200;Die römische Kirche und an alle, zu denen die Beschwerde der Kleriker aus Reims gelangt ist;römische Kirche und an alle, zu denen die Beschwerde der Kleriker aus Reims;372;Empfänger;römische Kirche und an alle, zu denen die Beschwerde der Kleriker aus Reims;Reims;t:persName
i02155;Erzbischöfe, Bischöfe, Äbte sowie die übrigen Religiosen und sapientes;Erzbischöfen, Bischöfen, Äbten sowie den übrigen Religiosen und sapientes;426;Empfänger;Erzbischöfen, Bischöfen, Äbten sowie den übrigen Religiosen und;;t:persName
i02153;Erzbischöfe, Bischöfe, Äbte und andere Kirchenprälaten im Königreich Frankreich;Erzbischöfe, Bischöfe, Äbte und andere Kirchenprälaten im Königreich Frankreich;975;Empfänger;Erzbischöfe, Bischöfe, Äbte und andere Kirchenprälaten im Königreich Frankreich;Frankreich;t:persName
i07582;Esrom, Zisterzienserabtei;Zisterzienserabtei Esrom Diözese Roskilde, Dänemark;1103;Empfänger;Zisterzienserabtei Esrom (Diözese Roskilde, Dänemark);Esrom (Diözese Roskilde, Dänemark);t:orgName
i02343;Étrun-lès-Arras, Frauenabtei Notre-Dame-et-Sainte-Madelein;Frauenabtei Notre-Dame-et-Sainte-Madelein in Étrun-lès-Arras arr. Arras, Pas-de-Calais, Diözese Arras;1101;Empfänger;Frauenabtei Notre-Dame-et-Sainte-Madelein in Étrun-lès-Arras (arr. Arras, Pas-de-Calais, Diözese Arras);Notre-Dame-et-Sainte-Madelein in Étrun-lès-Arras (arr. Arras, Pas-de-Calais, Diözese Arras);t:orgName
i02011;Ferrara, Domkapitel;Domkanoniker in Ferrara;1094;Empfänger;Domkanoniker in Ferrara;Ferrara;t:persName
i07583;Fitero, Zisterzienserabtei;Zisterzienserabtei Fitero Diözese Pamplona;1036;Empfänger;Zisterzienserabtei Fitero (Diözese Pamplona);Fitero (Diözese Pamplona);t:orgName
i07609;Genua, Kirche und Volk;Genua, Kirche und Volk;;;;;
i02645;Gesandte der Synode von Senlis 990;Gesandte der Synode von Senlis;195;Empfänger;Gesandte der Synode von Senlis;Senlis;t:persName
i05655;Grandmont, Priorei;Prior und Brüder von Grandmont;1122a;Empfänger;Prior und Brüder von Grandmont;Grandmont;t:persName
i04391;Kirche von Reims;Kirche von Reims;6;Empfänger;Kirche von Reims;Reims;t:orgName
i04489;Klerus und Volk von Reims;Klerus und Volk von Reims;153;;Klerus und Volk von Reims;Reims;t:orgName
i04376;Lobbes, Abtei Saint-Pierre;Kirche von Lobbes;1002;;Kirche von Lobbes;Lobbes;t:orgName
i05598;Lonato, Pfarrkirche San Zeno;Lonato, Pfarrkirche San Zeno;1091;Empfänger;Pieve San Zeno in Lonato (Diözese Verona);San Zeno in Lonato (Diözese Verona);t:orgName
i02438;Mitbischöfe, Fürsten und alle Gläubigen der katholischen Kirche;Fürsten und alle Gläubigen der katholischen Kirche;18;Empfänger;Fürsten und alle Gläubigen der katholischen Kirche;;t:persName
i05140;Mitbischöfe, Priester und die übrigen kirchlichen Ordines, die Fürsten, Herzöge und Grafen und alle Christgläubigen;Mitbischöfe, Priester und die übrigen kirchlichen Ordines, die Fürsten, Herzöge und Grafen und alle Christgläubigen;12;Empfänger;Mitbischöfe, Priester und die übrigen kirchlichen Ordines, die Fürsten, Herzöge und Grafen und alle Christgläubigen;;t:persName
i07594;Mortain, Zisterzienserinnenabtei Les Blanches;Zisterzienserinnenabtei Les Blanches in Mortain arr. Avranches, Manche;1100;Empfänger;Zisterzienserinnenabtei Les Blanches in Mortain (arr. Avranches, Manche);Les Blanches in Mortain (arr. Avranches, Manche);t:orgName
i02344;Nyoiseau, Frauenabtei Notre-Dame;Frauenabtei Notre-Dame in Nyoiseau c. et arr. Segré, Maine-et-Loire;1089;Empfänger;Frauenabtei Notre-Dame in Nyoiseau (c. et arr. Segré, Maine-et-Loire);Notre-Dame in Nyoiseau (c. et arr. Segré, Maine-et-Loire);t:orgName
i07588;Orval, Zisterzienserabtei;Zisterzienserabtei Orval Villers-devant-Orval, Prov. Luxembourg, Belgien, Diöz. Trier;1060;;Zisterzienserabtei Orval (Villers-devant-Orval, Prov. Luxembourg, Belgien, Diöz. Trier);Orval (Villers-devant-Orval, Prov. Luxembourg, Belgien, Diöz. Trier);t:orgName
i06261;Paris, Abtei Sainte-Geneviève;Sainte-Geneviève in Paris;1098;Empfänger;Sainte-Geneviève in Paris;Paris;t:orgName
i02015;Passau, Domkapitel;Domkapitel in Passau Bayern;1040;Empfänger;Domkapitel in Passau (Bayern);Passau (Bayern);t:orgName
i07006;Prälaten der Kirchenprovinz Köln;und Köln;1129;Empfänger;und Köln;Köln;t:persName
i01244;Prälaten der Kirchenprovinz Reims;andere Kirchenprälaten der Kirchenprovinz Reims;1118;Empfänger;andere Kirchenprälaten der Kirchenprovinz Reims;Kirchenprovinz Reims;t:persName
o00174;;Aachen;197;Ort;Aachen?;Aachen?;t:placeName
;;;198;Ort;Aachen;Aachen;t:placeName
i01125;Prälaten der Kirchenprovinzen Reims und Laon;alle Kirchenprälaten;1078;Empfänger;alle Kirchenprälaten;;t:persName
i00199;Prälaten der Kirchenprovinzen Reims und Rouen;Äbte, Archidiakone, Pröpste, Prioren und Priester in ihren Diözesen;1056;Empfänger;Äbte, Archidiakone, Pröpste, Prioren und Priester in ihren Diözesen;;t:persName
i01474;Préaux, Benediktinerabtei Saint-Pierre;Benediktinerabtei Saint-Pierre in Préaux c. Darnétal, arr. Rouen, Seine-Maritime, Diözese Rouen;1041;Empfänger;Benediktinerabtei Saint-Pierre in Préaux (c. Darnétal, arr. Rouen, Seine-Maritime, Diözese Rouen);Saint-Pierre in Préaux (c. Darnétal, arr. Rouen, Seine-Maritime, Diözese Rouen);t:orgName
i00246;Reims, Abtei Saint-Nicaise;Abtei Saint-Nicaise, Reims;378;;Abtei Saint-Nicaise ;Saint-Nicaise;t:orgName
;;;214;Aussteller;Abbo, Abt von Fleury (Saint-Benoît-sur-Loire, c. Ouzouer-sur-Loire, arr. Orléans, Loiret);Fleury (Saint-Benoît-sur-Loire, c. Ouzouer-sur-Loire, arr. Orléans, Loiret);t:persName
;;;213;;Abbos von Fleury;Fleury;t:persName
i02024;Reims, Domkapitel;Dompropst, Domdekan und Domkapitel in Reims;936;;Dompropst, dem Domdekan und dem Domkapitel in Reims;Reims;t:persName
;;;163;Empfänger;(Abbo), Bischof von Soissons;Soissons;t:persName
i01470;Saint-Benoît-sur-Loire, Benediktinerabtei;Benediktinerabtei Saint-Benoît-sur-Loire c. Ouzouer-sur-Loire, arr. Orléans, Loiret;1102;Empfänger;Benediktinerabtei Saint-Benoît-sur-Loire (c. Ouzouer-sur-Loire, arr. Orléans, Loiret);Saint-Benoît-sur-Loire (c. Ouzouer-sur-Loire, arr. Orléans, Loiret);t:orgName
;;;5;;Abel;;t:persName
;;;3;Empfänger;Abel, (Erz)bischof von Reims;Reims;t:persName
i04444;Saint-Jean-de-Maurienne, bischöfliche Kirche;Kirche von Saint-Jean-de-Maurienne Savoie;1096;Empfänger;Kirche von (Saint-Jean-de-)Maurienne (Savoie);(Saint-Jean-de-)Maurienne (Savoie);t:orgName
i01874;Saint-Taurin, Cluniazenserpriorat;Cluniazenserpriorat Saint-Taurin LÉchelle-Saint-Aurin, c. Roye, arr. Montdidier, Somme, Diözese Amiens;1038;Empfänger;Cluniazenserpriorat Saint-Taurin (L’Échelle-Saint-Aurin, c. Roye, arr. Montdidier, Somme, Diözese Amiens);Saint-Taurin (L’Échelle-Saint-Aurin, c. Roye, arr. Montdidier, Somme, Diözese Amiens);t:orgName
;;;47;Aussteller;abgesetzten Kleriker und Mönche;;t:persName
;;;49;;(abgesetzten) Kleriker und Mönche;;t:persName
i07590;Savigny, Zisterzienserabtei Sainte-Trinité;Zisterzienserabtei Sainte-Trinité in Savigny c. Cerisy-la-Salle, arr. Coutances, Manche;1099;Empfänger;Zisterzienserabtei Sainte-Trinité in Savigny (c. Cerisy-la-Salle, arr. Coutances, Manche);Savigny (c. Cerisy-la-Salle, arr. Coutances, Manche);t:orgName
i02023;Thérouanne, Domkapitel;Domkapitel von Thérouanne;416;Empfänger;Domkapitel von Thérouanne;Thérouanne;t:persName
i01471;Tonnerre, Benediktinerabtei Saint-Michel;Benediktinerabtei Saint-Michel in Tonnerre arr. Avallon, Yonne, Diözese Langres;1090;Empfänger;Benediktinerabtei) Saint-Michel in Tonnerre (arr. Avallon, Yonne, Diözese Langres);Saint-Michel in Tonnerre (arr. Avallon, Yonne, Diözese Langres);t:orgName
i01472;Tournus, Benediktinerabtei Saint-Philibert;Benediktinerabtei Saint-Philibert in Tournus arr. Macon, Saône-et-Loire, exemt, Diözese Chalon-sur-Saône;1037;Empfänger;Benediktinerabtei Saint-Philibert in Tournus (arr. Macon, Saône-et-Loire, exemt, Diözese Chalon-sur-Saône);Saint-Philibert in Tournus (arr. Macon, Saône-et-Loire, exemt, Diözese Chalon-sur-Saône);t:orgName
i01932;Tours, Kapitel Saint-Martin;Dekan, Thesaurar und Kapitel von Saint-Martin de Tours;1109a;Empfänger;Dekan, Thesaurar und Kapitel von Saint-Martin de Tours;Saint-Martin de Tours;t:persName
i04252;Treviso, Domkapitel San Pietro;Kathedrale San Pietro in Treviso;1093;Empfänger;Kathedrale San Pietro in Treviso;San Pietro in Treviso;t:orgName
i06583;Verona, Stiftskirche Santo Stefano;Stiftskirche Santo Stefano in Verona;1104;Empfänger;Stiftskirche Santo Stefano in Verona;Santo Stefano in Verona;t:orgName
i05855;Waltham, Regularkanonikerabtei Holy Cross;Regularkanonikerabtei Holy Cross in Waltham Essex;1095;Empfänger;Regularkanonikerabtei Holy Cross in Waltham (Essex);Holy Cross in Waltham (Essex);t:orgName
i00003;;, außerhalb der Stadt Mouzon arr. Sedan, Ardennes;1042;;, außerhalb der Stadt Mouzon (arr. Sedan, Ardennes);Mouzon (arr. Sedan, Ardennes);t:orgName
i00007;;, Écoivres c. Saint-Pol-sur-Ternoise, arr. Arras, ibid.;1071;;, Écoivres (c. Saint-Pol-sur-Ternoise, arr. Arras, ibid.);Écoivres (c. Saint-Pol-sur-Ternoise, arr. Arras, ibid.);t:orgName
i00109;;, La Valroy-le-Petit, c. Château-Porcien, arr. Rethel, Ardennes;1051;;, La Valroy(-le-Petit, c. Château-Porcien, arr. Rethel, Ardennes);La Valroy(-le-Petit, c. Château-Porcien, arr. Rethel, Ardennes);t:orgName
;;;1047;Empfänger;Äbte, Archidiakone, Pröpste und Priester in ihren Diözesen;;t:persName
;;;1051;Empfänger;Äbte, Archidiakone, Pröpste und Priester in ihren Diözesen;;t:persName
;;;1052;Empfänger;Äbte, Archidiakone, Pröpste und Priester in ihren Diözesen;;t:persName
;;;1057;Empfänger;Äbte, Archidiakone, Pröpste und Priester in ihren Diözesen;;t:persName
;;;1119;Empfänger;Äbte, Archidiakone, Pröpste und Priester in ihren Diözesen;;t:persName
i00148;;, Saint-Basle c. Verzy, arr. Reims;1042;;, Saint-Basle (c. Verzy, arr. Reims);Saint-Basle (c. Verzy, arr. Reims);t:orgName
i00149;;, Saint-Denis;1042;;, Saint-Denis;Saint-Denis;t:orgName
i00150;;, Saint-Nicaise;1042;;, Saint-Nicaise;Saint-Nicaise;t:orgName
i00151;;, Saint-Pierre in Hautvillers c. Ay, arr. Reims;1042;;, Saint-Pierre in Hautvillers (c. Ay, arr. Reims);Saint-Pierre in Hautvillers (c. Ay, arr. Reims);t:orgName
i00152;;, Saint-Pierre-les-Dames in Reims;1042;;, Saint-Pierre-les-Dames in Reims;Saint-Pierre-les-Dames in Reims;t:orgName
;;;603;;Abtei Clairvaux (cne Ville-sous-la-Ferté, c. et arr. Bar-sur-Aube, Aube);Clairvaux (cne Ville-sous-la-Ferté, c. et arr. Bar-sur-Aube, Aube);t:orgName
i00154;;, Saint-Thierry c. Bourgogne, arr. Reims, Marne;1042;;, Saint-Thierry (c. Bourgogne, arr. Reims, Marne);Saint-Thierry (c. Bourgogne, arr. Reims, Marne);t:orgName
;;;976;;Abtei Cluny (arr. Mâcon, Saône-et-Loire);Cluny (arr. Mâcon, Saône-et-Loire);t:orgName
i00158;;, Sint-Niclaas;1015;;, Sint-Niclaas;Sint-Niclaas;t:orgName
;;;253;;Abtei Corbie;Corbie;t:orgName
;;;390;;Abtei Corbie;Corbie;t:orgName
i00162;;[und Sint-Pieters] in Gent;1015;;[und Sint-Pieters] in Gent;Sint-Pieters] in Gent;t:orgName
;;;918;;Abtei Corbie (arr. Amiens, Somme);Corbie (arr. Amiens, Somme);t:orgName
i00177;;abbatia Saint-Timothée;189;;abbatia Saint-Timothée;Saint-Timothée;t:orgName
;;;489;;Abtei Corbie (Somme);Corbie (Somme);t:orgName
i00212;;Abtei Bohéries Vadencourt-Bohéries, c. Guise, arr. Vervins, Aisne;1074;;Abtei Bohéries (Vadencourt-Bohéries, c. Guise, arr. Vervins, Aisne);Bohéries (Vadencourt-Bohéries, c. Guise, arr. Vervins, Aisne);t:orgName
i00213;;Abtei Clairvaux cne Ville-sous-la-Ferté, c. et arr. Bar-sur-Aube, Aube;602;;Abtei Clairvaux (cne Ville-sous-la-Ferté, c. et arr. Bar-sur-Aube, Aube);Clairvaux (cne Ville-sous-la-Ferté, c. et arr. Bar-sur-Aube, Aube);t:orgName
i00215;;Abtei Cluny arr. Mâcon, Saône-et-Loire;431;;Abtei Cluny (arr. Mâcon, Saône-et-Loire);Cluny (arr. Mâcon, Saône-et-Loire);t:orgName
i00220;;Abtei Corbie arr. Amiens, Somme;815;;Abtei Corbie (arr. Amiens, Somme);Corbie (arr. Amiens, Somme);t:orgName
i00222;;Abtei Corbie Somme;391;;Abtei Corbie (Somme);Corbie (Somme);t:orgName
i00224;;Abteien, Saint-Arnoul in Metz;278;;Abteien, (Saint-Arnoul) in Metz;Metz;t:orgName
i00225;;Abteien Ham-sur-Somme, arr. Péronne, Somme;673;;Abteien Ham(-sur-Somme, arr. Péronne, Somme);Ham(-sur-Somme, arr. Péronne, Somme);t:orgName
i00226;;Abteien von Épernay Marne;1042;;Abteien von Épernay (Marne);Épernay (Marne);t:orgName
i00227;;Abtei Jouy;1005;;Abtei Jouy;Jouy;t:orgName
i00228;;Abteikirche Saint-Remi;222;;Abteikirche Saint-Remi;Saint-Remi;t:orgName
i00229;;Abteikirche von Reims;224;;Abteikirche von Reims;Reims;t:orgName
;;;1114a;;Abtei Mont-Saint-Éloi;Mont-Saint-Éloi;t:orgName
;;;1115a;;Abtei Mont-Saint-Éloi;Mont-Saint-Éloi;t:orgName
i00230;;Abtei Le Mont-Saint-Quentin cne Péronne, Somme;365;;Abtei Le Mont-Saint-Quentin (cne Péronne, Somme);Le Mont-Saint-Quentin (cne Péronne, Somme);t:orgName
i00231;;Abtei Liessies c. Solre-le-Château, arr. Avesnes-sur-Helpe, Nord;967;;Abtei Liessies (c. Solre-le-Château, arr. Avesnes-sur-Helpe, Nord);Liessies (c. Solre-le-Château, arr. Avesnes-sur-Helpe, Nord);t:orgName
i00232;;Abtei Maubeuge ibid.;967;;Abtei Maubeuge (ibid.);Maubeuge (ibid.);t:orgName
i00233;;Abtei Montier-en-Der arr. Saint-Dizier, Haute-Marne, Diözese Châlons-en-Champagne;227;;Abtei Montier-en-Der (arr. Saint-Dizier, Haute-Marne, Diözese Châlons-en-Champagne);Montier-en-Der (arr. Saint-Dizier, Haute-Marne, Diözese Châlons-en-Champagne);t:orgName
i00234;;Abtei Mont-Saint-Éloi;1113a;;Abtei Mont-Saint-Éloi;Mont-Saint-Éloi;t:orgName
i00237;;Abtei Ribemont;994;;Abtei Ribemont;Ribemont;t:orgName
i00238;;Abtei Saint-Basle c. Verzy, arr. Reims, Marne;809;;Abtei Saint-Basle (c. Verzy, arr. Reims, Marne);Saint-Basle (c. Verzy, arr. Reims, Marne);t:orgName
i00239;;Abtei Saint-Calais arr. Le Mans, Sarthe;65;;Abtei Saint-Calais (arr. Le Mans, Sarthe);Saint-Calais (arr. Le Mans, Sarthe);t:orgName
;;;500;;Abtei Saint-Médard (Soissons, Aisne);Saint-Médard (Soissons, Aisne);t:orgName
i00240;;Abtei Saint-Denis;1061;;Abtei Saint-Denis;Saint-Denis;t:orgName
;;;265b;;Abtei Saint-Nicaise in Reims;Reims;t:orgName
i00241;;Abtei Saint-Denis-en-France;491;;Abtei Saint-Denis-en-France;Saint-Denis-en-France;t:orgName
;;;377;;Abtei Saint-Remi;Saint-Remi;t:orgName
;;;979;;Abtei Saint-Remi;Saint-Remi;t:orgName
i00242;;Abtei Saint-Denis-en-France Seine-Saint-Denis;1019;;Abtei Saint-Denis-en-France (Seine-Saint-Denis);Saint-Denis-en-France (Seine-Saint-Denis);t:orgName
i00243;;Abtei Saint-Denis in Reims;265a;;Abtei Saint-Denis in Reims;Reims;t:orgName
i00244;;Abtei Saint-Médard Soissons, Aisne;219;;Abtei Saint-Médard (Soissons, Aisne;Saint-Médard (Soissons, Aisne;t:orgName
i00248;Reims, Abtei Saint-Remi;Abtei Saint-Remi;278;;Abtei Saint-Remi;Saint-Remi;t:orgName
i00251;;Abtei Sint-Baafs in Gent;1131;;Abtei Sint-Baafs in Gent;Sint-Baafs in Gent;t:orgName
;;;734;;Äbte von Saint-André-du-Câteau;Saint-André-du-Câteau;t:persName
;;;786;;Äbte von Saint-André-du-Câteau;Saint-André-du-Câteau;t:persName
i01127;;Allod Vaux-sous-Laon cne Laon, Aisne;859;;Allod Vaux-sous-Laon (cne Laon, Aisne);Vaux-sous-Laon (cne Laon, Aisne);t:orgName
;;;585;;Äbten von Saint-Remi;Saint-Remi;t:persName
i01128;;Altar von Celles und Orrior;1079d;;Altar von Celles und Orrior;Celles und Orrior;t:orgName
i01316;;Arras;1042;;, Arras;Arras;t:orgName
i01440;;Beauvais;1042;;, Beauvais;Beauvais;t:orgName
i01473;;Benediktinerabtei Saint-Pierre-aux-Monts in Châlons-en-Champagne;1031;;Benediktinerabtei Saint-Pierre-aux-Monts (in Châlons-en-Champagne);Saint-Pierre-aux-Monts (in Châlons-en-Champagne);t:orgName
i01475;;Benediktinerabtei Saint-Vincent vor Laon;477;;Benediktinerabtei Saint-Vincent vor Laon;Saint-Vincent vor Laon;t:orgName
i01476;;Benediktinerabtei Sint-Pieters;1015;;Benediktinerabtei Sint-Pieters;Sint-Pieters;t:orgName
i01615;;Bischofssitzes von Cambrai;68;;Bischofssitzes von Cambrai;Cambrai;t:orgName
i01677;;Bistum Orléans;250;;Bistum Orléans;Orléans;t:orgName
i01678;;Bistum Reims;179;;Bistum Reims;Reims;t:orgName
;;;781;;Äbtissin von Saint-Pierre in Reims;Saint-Pierre in Reims;t:persName
i01679;;Amiens, Bistum;190;;Bistums Amiens;Amiens;t:orgName
i01794;;Cambrai;1042;;, Cambrai;Cambrai;t:orgName
i01814;;Châlons-en-Champagne;1042;;, Châlons-en-Champagne;Châlons-en-Champagne;t:orgName
i01828;;Château Couzy;979;;Château Couzy;Couzy;t:orgName
i01860;;Clermont;285;;, Clermont;Clermont;t:orgName
i01873;;Cluniazenserpriorates Gaye östl. Sézanne, Marne, Diözese Troyes;460;;Cluniazenserpriorates Gaye (östl. Sézanne, Marne, Diözese Troyes);Gaye (östl. Sézanne, Marne, Diözese Troyes);t:orgName
i01875;;Cluniazenserpriorats Coincy c. Fère-en-Tardenois, arr. Saint-Thierry, Aisne;314;;Cluniazenserpriorats Coincy (c. Fère-en-Tardenois, arr. Saint-Thierry, Aisne);Coincy (c. Fère-en-Tardenois, arr. Saint-Thierry, Aisne);t:orgName
i01919;;Cysoing, arr. Lille, Nord;136;;(Cysoing, arr. Lille, Nord);, arr. Lille, Nord);t:orgName
i01954;;der von Noyon;350;;der von Noyon;Noyon;t:orgName
;;;1079d;Empfänger;Abt und Brüder der Abtei Saint-Thierry bei Reims;Abtei Saint-Thierry bei Reims;t:persName
;;;1079g;Empfänger;Abt und Brüder der Abtei Saint-Thierry bei Reims;Abtei Saint-Thierry bei Reims;t:persName
i01985;;Diözese Châlons;957;;Diözese Châlons;Châlons;t:orgName
i01986;;Diözese Laon;871;;Diözese Laon;Laon;t:orgName
i01988;;Diözese Lüttich;1128;;Diözese Lüttich;Lüttich;t:orgName
i01989;;Diözesen seiner Suffragane;746;;Diözesen seiner Suffragane;;t:orgName
i01990;;Diözesen Soissons;1042;;Diözesen Soissons;Soissons;t:orgName
i01992;;Diözese Toul;753;;Diözese Toul;Toul;t:orgName
;;;819;;Abtes und der Brüder (der Prämonstratenserabtei) de Mari;Prämonstratenserabtei) de Mari;t:persName
i01995;;Diözese Tournai;385;;Diözese Tournai;Tournai;t:orgName
i02013;;Domkapitel;1086;;Domkapitel;;t:orgName
i02014;;Domkapitel in Chartres;773;;(Dom)kapitel in Chartres;Chartres;t:orgName
i02016;;Domkapitels in Châlons;736;;Domkapitels in Châlons;Châlons;t:orgName
i02017;;Domkapitel von Cambrai Nord;785;;Domkapitel von Cambrai (Nord);Cambrai (Nord);t:orgName
i02018;;Domkapitel von Châlons-en-Champagne;842;;Domkapitels in Châlons(-en-Champagne);Châlons(-en-Champagne);t:orgName
i02020;;Domkapitel von Laon;1121a;;Domkapitel von Laon;Laon;t:orgName
i02021;;Domkapitel von Notre-Dame in Laon;1063;;Domkapitel von Notre-Dame in Laon;Notre-Dame in Laon;t:orgName
i02022;;Domkapitel von Notre-Dame in Senlis;1029;;Domkapitel von Notre-Dame in Senlis;Notre-Dame in Senlis;t:orgName
;;;1127e;Empfänger;Abt und Brüder des Klosters Saint-Pierre in Corbie;Saint-Pierre in Corbie;t:persName
i02091;;ecclesia Gallicana;518;;ecclesia Gallicana;Gallicana;t:orgName
i02178;;erzbischöflichen Stuhl in Reims;1013;;erzbischöflichen Stuhl in Reims;Reims;t:orgName
i02280;;Festung in Sept-Saulx c. Verzy, arr. Reims, Marne;893;;Festung in Sept-Saulx (c. Verzy, arr. Reims, Marne);Sept-Saulx (c. Verzy, arr. Reims, Marne);t:orgName
i02281;;Festung Mouzon Ardennes;1135;;Festung Mouzon (Ardennes);Mouzon (Ardennes);t:orgName
;;;769;;Abtes und der Brüder von Cercamp (cne Frévant, c. Auxi-le-Château, arr. Arras, Pas-de-Calais);Cercamp (cne Frévant, c. Auxi-le-Château, arr. Arras, Pas-de-Calais);t:persName
i02313;;Fraisnois genannt und bei Cambrai Nord;957;;Fraisnois genannt und bei Cambrai (Nord);Cambrai (Nord);t:orgName
i02496;;Galliens;30;Empfänger;Galliens;Galliens;t:orgName
i02644;;gesamte Kirche von Reims;441;Aussteller;gesamte Kirche von Reims;Reims;t:orgName
i02795;;Grundherrschaften von Notre-Dame;418;;Grundherrschaften von Notre-Dame;Notre-Dame;t:orgName
i03751;;Hospital bei Valenciennes Nord;788;;Hospital bei Valenciennes (Nord);Valenciennes (Nord);t:orgName
i03752;;Hospitals von Jerusalem;886;;Hospitals von Jerusalem;Jerusalem;t:orgName
i04064;;Johanniter;685;;Johanniter;;t:orgName
i04069;;Johanniterbrüder;957;;Johanniterbrüder;;t:orgName
i04185;;Kapellanie Maceium;504;;Kapellanie in Maceium;Maceium;t:orgName
i04187;;Kapellen Sint-Jans;1015;;Kapellen Sint-Jans;Sint-Jans;t:orgName
;;;795;;Abtes und der Brüder von Maroilles (c. Landrecies, arr. Avesnes-sur-Helpe, Nord);Maroilles (c. Landrecies, arr. Avesnes-sur-Helpe, Nord);t:persName
i04188;;Kapelle Sankt Trinitatis;223b;;Kapelle Sankt Trinitatis;;t:orgName
i04189;;Kapelle von Bonne-Voisine;461;;Kapelle von Bonne-Voisine;Bonne-Voisine;t:orgName
i04190;;Kapelle von Bonne-Voisine östlich Champfleury, ca. 8 km nordöstl. PLancy-lAbbaye, arr. Méry-sur-Seine, Aube;460;;Kapelle von Bonne-Voisine (östlich Champfleury, ca. 8 km nordöstl. PLancy-l’Abbaye, arr. Méry-sur-Seine, Aube);Bonne-Voisine (östlich Champfleury, ca. 8 km nordöstl. PLancy-l’Abbaye, arr. Méry-sur-Seine, Aube);t:orgName
i04191;;Kapelle von Kooigem;1079d;;Kapelle von Kooigem;Kooigem;t:orgName
i04193;;Kapitel der Abtei Corbie arr. Amien, Somme;917;Empfänger;Kapitel der Abtei Corbie (arr. Amien, Somme);Corbie (arr. Amien, Somme);t:orgName
i04195;;Kapitel von;445;Empfänger;Kapitel von;;t:orgName
i04197;;Kapitel von Péronne;1124b;Empfänger;Kapitel von Péronne;Péronne;t:orgName
i04245;;Kartäuserniederlassungen Le Mont-Dieu Diözese Reims;1035;;Kartäuserniederlassungen Le Mont-Dieu (Diözese Reims);Le Mont-Dieu (Diözese Reims);t:orgName
;;;944;;Abtes und der Brüder (von Saint-Corneille) in Compiègne (Oise);Saint-Corneille) in Compiègne (Oise);t:persName
;;;945;;Abt und Brüder (von Saint-Corneille) in Compiègne (Oise);Saint-Corneille) in Compiègne (Oise);t:persName
;;;953;;Abtes und der Brüder (von Saint-Corneille) in Compiègne (Oise);Saint-Corneille) in Compiègne (Oise);t:persName
i04248;;Kathedrale;224;;Kathedrale;;t:orgName
i04250;;Kathedrale in Châlons;1075;;Kathedrale in Châlons;Châlons;t:orgName
i04251;;Kathedrale Notre-Dame;1126;;Kathedrale Notre-Dame;Notre-Dame;t:orgName
i04253;;Kathedrale von Laon;1072;;Kathedrale von Laon;Laon;t:orgName
